[
  {
    "sku": "FMT-BO-CO-2025",
    "product_name": "Batana Oil Hair Conditioner",
    "seal": "Cleansing & Restorative",
    "collection": "Batana Oil",
    "botanical_source": "Elaeis oleifera",
    "hs_code": 33059000,
    "part_used": "kernel oil",
    "product_description": "A deep-conditioning ritual rooted in Miskito tradition. Crafted with authentic Batana Oil from the wild Elaeis oleifera palms of La Mosquitia, Honduras, this formula transforms hair through ancestral nourishment. Used for generations to restore, soften, and protect, it delivers penetrating moisture while honoring the wisdom of the rainforest. From the hands of Miskito artisans to your hair care routine, it bridges ancient practice with modern performance. Free from silicones, parabens, synthetic fragrances, and harsh chemicals, our conditioner works in harmony with your hair's natural structure to reveal strength, shine, and vitality from within.",
    "ingredients": "100% batana oil formulated for deep conditioning with natural emulsifiers and conditioning agents; rich in triglycerides and vitamins.",
    "traditional_uses": "• Deep hair conditioning\n• Strengthening and repair\n• Enhanced texture and shine\n• Frizz control",
    "processing_method": "• Harvesting: Collection of ripe fruit from the American oil palm (Elaeis oleifera) and conditioning herbs.\n• Oil Extraction: The Miskito people apply their ancestral and traditional method to extract pure Batana oil.\n• Herb Preparation: Conditioning herbs and flowers are gently heated in water to release their moisturizing properties.\n• Infusion: The Batana oil is infused with the strained herbal water and other natural emollients.\n• Emulsification: The mixture is stirred continuously until it cools and thickens into a rich, consistent blend.\n• Settling & Storage: The final conditioner is allowed to settle before being stored in containers, ready for use.",
    "country_of_origin": "Honduras",
    "hero_image_reference": "assets/products-images/batana-oil/hero/fmt-bo-co-2025-hero.png",
    "doc_reference": "docs/collections/batana-oil.md"
  },
  {
    "sku": "FMT-BO-RBO-2025",
    "product_name": "Raw Batana Oil",
    "seal": "Pure & Unrefined",
    "collection": "Batana Oil",
    "botanical_source": "Elaeis oleifera",
    "hs_code": 15159099,
    "part_used": "kernel oil",
    "product_description": "This is the essence, the true Batana Oil. A powerful testament to the power of natural ingredients. Sourced directly from the rainforests of La Mosquitia, Honduras, it is extracted from wild Elaeis oleifera palms and meticulously crafted by the hands of the Miskito people, using traditional methods passed down through generations. Known as the 'miracle oil', it represents a bridge between ancestral wisdom and modern wellness. From forest to customer, its unmatched quality is completely free from chemicals, additives, and vegetable oil blends.",
    "ingredients": "100% Elaeis oleifera (American oil palm) kernel oil, rich in essential fatty acids and vitamins.",
    "traditional_uses": "• Hair conditioning and repair\n• Scalp care and moisturization\n• Skin moisturization and protection\n• Beauty traditional uses",
    "processing_method": "• Cluster Harvesting: Only wild-grown palm clusters from mature Elaeis oleifera trees are collected.\n• Fruit Removal: Individual ripe fruits are manually detached from clusters and gathered in woven baskets.\n• Boiling: Fruits are boiled in clean water over controlled wood fires until adequate steam release indicates readiness.\n• Pulp Removal: Softened fruits are crushed in wooden mortars (pilón) to separate pulp and shells from kernels.\n• Sun-Drying: Kernels are sun-dried for 4–8 days, turned regularly for uniform moisture reduction.\n• Heat Extraction: Dried kernels are crushed and heated over controlled fires to gradually release the oil.\n• Filtration: Hot oil is strained through clean cotton cloth, then cooled gradually. No chemical filters are used.\n• Packing & Export: Oil is bottled in sterile containers and prepared to meet international export standards.",
    "country_of_origin": "Honduras",
    "hero_image_reference": "assets/products-images/batana-oil/hero/fmt-bo-rbo-2025-hero.png",
    "doc_reference": "docs/collections/batana-oil.md"
  },
  {
    "sku": "FMT-BO-SB-2025",
    "product_name": "Batana Oil True Soap Bar",
    "seal": "Concentrated & Artisanal",
    "collection": "Batana Oil",
    "botanical_source": "Elaeis oleifera",
    "hs_code": 34011100,
    "part_used": "kernel oil",
    "product_description": "A minimalist yet powerful cleanser forged in the heart of Honduras. Each bar is crafted by Miskito artisans using raw, pure Batana Oil extracted from Elaeis oleifera kernels, sourced directly from the rainforests of La Mosquitia. We present it as a daily invitation to experience wellness through tradition, connecting your skin to the pristine essence of ancestral care. It is naturally saponified, completely free from chemicals and deceptive additives.",
    "ingredients": "100% saponified oils including batana oil; natural glycerin; moisturizing fatty acids.",
    "traditional_uses": "• Nourishing cleansing\n• Skin hydration and softening\n• Helps diminish skin marks\n• Hair and body use",
    "processing_method": "• Harvesting: Collection of ripe fruit from the American oil palm (Elaeis oleifera).\n• Oil Extraction: Miskito people applied their ancestral and traditional method to extract batana oil.\n• Lye Preparation: A natural plant-based lye solution is prepared.\n• Saponification: The filtered lye solution is combined with batana oil and stirred continuously until the mixture thickens to trace.\n• Molding: The soap paste is poured into frames or containers to set.\n• Curing: Sun-dry the cut soap bars for several days to harden and neutralize fully.",
    "country_of_origin": "Honduras",
    "hero_image_reference": "assets/products-images/batana-oil/hero/fmt-bo-sb-2025-hero.png",
    "doc_reference": "docs/collections/batana-oil.md"
  },
  {
    "sku": "FMT-BO-SH-2025",
    "product_name": "Batana Oil Hair Wash",
    "seal": "Gentle & Nourishing",
    "collection": "Batana Oil",
    "botanical_source": "Elaeis oleifera",
    "hs_code": 33051000,
    "part_used": "kernel oil",
    "product_description": "Experience the ancestral cleansing ritual of the Miskito people through this gentle hair wash. Formulated with authentic Batana Oil sourced from wild Elaeis oleifera palms in La Mosquitia, it honors generations of hair-strengthening tradition while meeting modern wellness standards. Our sulfate-free formula preserves hair's natural balance, delivering deep nourishment from root to tip without harsh detergents or synthetic additives.",
    "ingredients": "100% batana oil derived from Elaeis oleifera kernel oil, blended with plant-based cleansing compounds. Rich in essential fatty acids and vitamins.",
    "traditional_uses": "• Hair strengthening and repair\n• Enhanced shine and softness\n• Scalp health support\n• Helps detangle",
    "processing_method": "• Harvesting: Collection of ripe fruit from the American oil palm (Elaeis oleifera) and saponin-rich plants.\n• Oil Extraction: The Miskito people apply their ancestral and traditional method to extract pure Batana oil.\n• Saponin Preparation: A natural plant-based lather solution is prepared by boiling and straining saponin-rich plants.\n• Emulsification: The filtered plant lather solution is combined with Batana oil and stirred continuously until a stable, creamy emulsion forms.\n• Infusion: The mixture is infused with local herbs for fragrance and additional hair benefits.\n• Settling & Storage: The final shampoo is allowed to settle before being stored in containers, ready for use.",
    "country_of_origin": "Honduras",
    "hero_image_reference": "assets/products-images/batana-oil/hero/fmt-bo-sh-2025-hero.png",
    "doc_reference": "docs/collections/batana-oil.md"
  },
  {
    "sku": "FMT-SBH-JM-2025",
    "product_name": "Jimerito",
    "seal": "Raw & Unfiltered",
    "collection": "Stingless Bee Honey",
    "botanical_source": "Tetragonisca angustula",
    "hs_code": 4090000,
    "part_used": "wild honey",
    "product_description": "Honduran stingless bee Tetragonisca angustula (tribe Meliponini) species, known traditionally as the 'Abaja Jimerito'. Revered by Mayan cultures as a symbol of the sun's spirit and a vital link to forest health, this bee produces a honey of exceptional enzymatic and ancestral richness. Harvested by locals using artisanal practices. Free from chemicals, additives, and preservatives.",
    "ingredients": "100% Tetragonisca angustula stingless bee traditional honey, composed of antioxidants, enzymes, and trace minerals.",
    "traditional_uses": "• Boosts energy and immune defense\n• Promotes skin vitality\n• Traditional eye support\n• Gourmet uses and applications",
    "processing_method": "• Harvest Selection: Careful selection of honey pots from the natural nests of Tetragonisca angustula stingless bees.\n• Honey Extraction: Native harvesters apply their ancestral and traditional method to gently extract the unfiltered honey, ensuring the colony's preservation.\n• Separation: The honey is minimally separated from the larger pieces of wax and cerumen through slow, gravity-based straining.\n• Settling: The unpasteurized honey is allowed to settle naturally, maintaining its rich texture and beneficial particles.\n• Storage: The pure, unfiltered honey is stored in sealed containers, traditionally gourds or glass jars, protecting its unique properties.",
    "country_of_origin": "Honduras",
    "hero_image_reference": "assets/products-images/stingless-bee-honey/hero/fmt-sbh-jm-2025-hero.png",
    "doc_reference": "docs/collections/stingless-bee-honey.md"
  },
  {
    "sku": "FMT-TH-AL-2025",
    "product_name": "Gumbo Limbo Leaves",
    "seal": "Wildcrafted & Shade-Dried",
    "collection": "Traditional Herbs",